{
  "$schema": "../schemas/workspace.schema.json",
  "schema_version": "0.2",
  "id": "forge-workspace",
  "name": "Forge Workspace",
  "repository_catalog_id": "forge-catalog",
  "engineering_mode": "prototype",
  "governance_profile": "solo",
  "metadata": {
    "runtime": "local",
    "description": "A Workspace references its Repository Catalog instead of embedding repositories."
  }
}
